{
  "$schema": "https://json-schema.org/draft/2020-12/schema",
  "$id": "omnidriver/quantity-comparison.schema.json",
  "title": "Quantity comparison request",
  "description": "An agent's comparison: which runs, which artifact of each, where to sample, the reference, the pairs, and the tolerance declared before any value is read. Core adds no frame conversion, pairing or tolerance of its own.",
  "type": "object",
  "additionalProperties": false,
  "required": ["schema_version", "reference", "tolerance", "both_not_reached", "runs", "pairs"],
  "properties": {
    "schema_version": {"const": 1},
    "reference": {"type": "string", "minLength": 1},
    "tolerance": {"$ref": "#/$defs/tolerance"},
    "both_not_reached": {
      "enum": ["agree", "fail"],
      "description": "Pre-registered before any value is read, no default: whether a pair whose sentinel (e.g. -1, 'never reached') is resolved on both sides counts as agreement ('agree', it does not fail the report) or as a failure ('fail', exactly like outside_tolerance). Recorded in the report unchanged."
    },
    "runs": {"type": "object", "minProperties": 1, "additionalProperties": {"$ref": "#/$defs/run"}},
    "pairs": {"type": "array", "minItems": 1, "items": {"$ref": "#/$defs/pair"}}
  },
  "$defs": {
    "tolerance": {
      "type": "object", "additionalProperties": false, "required": ["kind", "value", "rationale"],
      "properties": {
        "kind": {"enum": ["absolute", "relative"]},
        "value": {"type": "number", "minimum": 0},
        "unit": {"type": "string", "minLength": 1},
        "rationale": {"type": "string", "minLength": 1}
      },
      "if": {"properties": {"kind": {"const": "absolute"}}, "required": ["kind"]},
      "then": {"required": ["unit"]},
      "else": {"not": {"required": ["unit"]}}
    },
    "run": {
      "type": "object", "additionalProperties": false,
      "required": ["plugin", "sweep_output", "case_id", "artifact_id"],
      "dependentRequired": {"max_sampling_offset": ["points"], "points": ["max_sampling_offset"]},
      "properties": {
        "plugin": {"type": "string", "minLength": 1},
        "sweep_output": {"type": "string", "minLength": 1},
        "case_id": {"type": "string", "minLength": 1},
        "artifact_id": {"type": "string", "minLength": 1},
        "points": {
          "description": "Two meanings, by the artifact's reader. For a reader that takes points (samples at supplied locations): where to sample, in this run's own frame and unit -- the reader receives them. For a reader that samples where it chooses: the agent's *expected* location of each named quantity, in this run's own frame and unit -- the reader never receives them; the comparison checks each sample's reported sampled_at against its expected point instead. Either meaning requires 'max_sampling_offset' (refused by the schema, before any read, if it is missing).",
          "type": "object", "additionalProperties": false, "required": ["unit", "at"],
          "properties": {
            "unit": {"type": "string", "minLength": 1},
            "at": {"type": "object", "minProperties": 1, "additionalProperties": {
              "type": "array", "items": {"type": "number"}, "minItems": 3, "maxItems": 3
            }}
          }
        },
        "max_sampling_offset": {
          "description": "Given exactly when 'points' is (either meaning above); pre-registered, no default, in the unit of 'points'. A number bounds every point; an object bounds each point on its own and must name exactly the points of 'points.at'.",
          "oneOf": [
            {"type": "number", "minimum": 0},
            {"type": "object", "additionalProperties": {"type": "number", "minimum": 0}}
          ]
        }
      }
    },
    "side": {
      "type": "object", "additionalProperties": false, "required": ["run", "quantity"],
      "properties": {"run": {"type": "string", "minLength": 1}, "quantity": {"type": "string", "minLength": 1}}
    },
    "pair": {
      "type": "object", "additionalProperties": false, "required": ["reference_label", "left", "right"],
      "properties": {
        "reference_label": {"type": "string", "minLength": 1},
        "left": {"$ref": "#/$defs/side"},
        "right": {"$ref": "#/$defs/side"},
        "tolerance": {"$ref": "#/$defs/tolerance"},
        "note": {"type": "string"}
      }
    }
  }
}
